{
  "schema": "gridsim-kind/2",
  "kind": "busbarSection",
  "title": "Busbar section (asset overlay)",
  "description": "Phase 5a asset overlay kind. One section of a substation busbar. It collapses to an existing authored bus (the bus ref): several sections may name the same bus when the authored model does not split them. Carried beside the model, never used by the solver.",
  "params": {
    "label": { "type": "string", "required": false, "description": "The section label on the single-line diagram (for example Main 1 section A).", "codeDefaults": [] },
    "ratedCurrentA": { "type": "number", "unit": "A", "min": 0, "required": false, "description": "Busbar continuous current rating, amperes.", "codeDefaults": [] }
  },
  "overlay": {
    "refs": {
      "bus": { "target": "bus", "required": true, "description": "The authored bus this section collapses to." }
    },
    "parentKinds": ["substation"],
    "parentRequired": true
  }
}
